I will desarrollaré tu aplicación para ios y android en flutterflow,
I will develop flutterflow mobile app and ios bubble app flutter app taxi app chatgpt,
I will build bubble web app bubble app  API  flutterflow  adalo  manychat  chatbot,
I will convert figma to flutter react native flutterflow mobile app development android,Level 2
I will use flutterflow to develop hybrid app android iphone app,Top Rated
I will do flutterflow developer firebase flutterflow flutter flow,Level 1
I will use flutterflow to develop hybrid app android and ios,
I will be your bubble io developer flutterflow  adalo  appgyver expert developer,
I will be your bubble developer do bubble io website bubble app adalo flutterflow softr,Level 1
I will do flutterflow flutter flow flutterflow ui flutterflow developer,
I will develop your mobile app using the flutter and flutterflow,
I will develop android and ios apps in flutterflow,
I will build flutter and flutterflow mobile app with firebase for android and ios,
I will adalo bubble flutterflow develop web app  mobile app on bubble adalo flutterflow,
I will integrate apis into your flutterflow application,Level 1
I will mobile app development flutter developer flutterflow developer IOS android 4u,
I will develop and maintain app in flutterflow,Level 2
I will bubble developer bubble website bubble app developer bubble io flutterflow app,
I will build your web app  mobile app  website  mvp on bubble io flutterflow powerapps,
I will develop flutter app  flutterflow  flutter ui and flutter flow,
I will be your bubble io saas developer bubble developer flutterflow chatgpt openai,Level 1
I will do flutter  react native mobile app development with flutterflow firebase,
I will be bubble io  flutterflow  adalo  webflow expert,
I will use flutterflow to develop an android and ios app,
I will flutter flutterflow custom flutter app dart,